,Setting,Media Link,Media Cedit,Media Credit Link,Description,Zoom,Marker,Marker Color, Location,Latitiude,Longitude,Overlay,Overlay Transparency,GeoJSON Overlay,GeoJSON Feature Properties,Media Credit,Location,Latitude
0,Overview of North Carolina,media/North Carolina Overlay.jpg,,N/A,"The North Carolina map displays several private schools near the cities of Raleigh, Wilmington, and Asheville.     There is an outlier, however, in the North Eastern part of North Carolina. This could be from high agriculture production making few people that live in the area causing the government to not fund for public schools, which makes funding for private schools necessary.",6.0,Hidden,,,,-80.793457,None,0.9,geojson/North Carolina Counties.geojson,fillColor:red;color:black,"Source: USGS, Tiger Line, IES - NCES, NC One Map, US Census Bureau",North Carolina,35.782169
1,North Carolina Poverty Spread,media/North Carolina Poverty Spread.jpg,,N/A,"From the poverty spread, North Carolina represents a strong correlation between the location of private schools and higher income communities.     The amount of people above the various poverty levels are represented near the cities and the cities from the previous map shown exemplify private schools.",6.0,Hidden,,,,-80.793457,None,0.9,geojson/North Carolina Counties.geojson,fillColor:red;color:black,"Source: USGS, Tiger Line, IES - NCES, NC One Map, US Census Bureau",North Carolina,35.782169
2,Overview of Wake County,media/Wake County Overlay.jpg,,N/A,Wake County has several private schools listed in it.     It has almost an equal amount of private schools as there public schools in the area.     It needs all of these schools because it holds the city of Raleigh and several hundreds of thousands of people live there. ,15.75,Hidden,,,,-78.6382,None,0.9,geojson/North Carolina Counties.geojson,fillColor:red;color:black,"Source: USGS, Tiger Line, IES - NCES, NC One Map, US Census Bureau",Wake County,35.7796
3,Wake County Poverty Spread,media/Wake County Poverty Spread.jpg,,N/A,Wake County is an econopmically feasible area to live in.     It holds hundred of thousnads of people in it and displays thousands of people well over the poverty line.     It speaks to the correlation of private schools being near the city due to Wake COunty holding Raleigh and the high amount of prosperous people. ,15.75,Hidden,,,,-78.6382,None,0.9,geojson/North Carolina Counties.geojson,fillColor:red;color:black,"Source: USGS, Tiger Line, IES - NCES, NC One Map, US Census Bureau",Wake County,35.7796
4,Overview of Illinois,media/Illinois Overlay.jpg,,N/A,"Illinois has very few private schools.     Most of the private schools listed in Illinois take place in Cook County where Chicago is, Rockford, East St. Louis and Springfield.     There is an outlier in the souther tip of Illinois, which can result from needing private systems due to the low population from agricultural land being there and the state government not wanting to fund these areas",6.0,Hidden,,,,-89.0,None,0.9,geojson/Illinois Counties.geojson,fillColor:blue;color:yellow,"Source: USGS, Tiger Line, IES - NCES, NC One Map, US Census Bureau",Illinois,40.0
5,Ilinois Poverty Spread,media/Illinois Poverty Spread.jpg,,N/A,"From the poverty spread, Illinois represents a strong correlation between the location of private schools and higher income communities.     Cook County and even Rockford are the two highest earning communities and cna be shown in the poverty spread maps.     These two areas have the most amount of private schoola in the state of Illinois and makes sense for the income involved there.",6.0,Hidden,,,,-89.0,None,0.9,geojson/Illinois Counties.geojson,fillColor:blue;color:yellow,"Source: USGS, Tiger Line, IES - NCES, NC One Map, US Census Bureau",Illinois,40.0
6,Overview of Kendall County,media/Kendall County Overlay.jpg,,N/A,"Kendall County, more specifically, Oswego only shows public schools in the area.     This could be from doing a selct by attribute to take out the religous private schools in the area to only look at private institutions that could appeal to the upper class.     This conclusion can be supported because I grew up in the area and know that all the private schools in the area are religous catholic schools.",15.75,Hidden,,,,-88.3514596,None,0.9,geojson/Illinois Counties.geojson,fillColor:blue;color:yellow,"Source: USGS, Tiger Line, IES - NCES, NC One Map, US Census Bureau",Kendall County,41.6828074
7,Kendall County Poverty Spread,media/Kendall County Poverty Spread.jpg,,N/A,"From the Kendall County povery spread maps, Kendall County portrays a high economic class community.     This makes it interesting because no public schools were shown in the Oswegoland area.     However, as discussed earlier, most of those schools could be religous and taken away from the school crtieria I am looking for.     Also the school system could be in great shape, which makes it to where no private institutions are needed to support all the social classes that go to these schools",15.75,Hidden,,,,-88.3514596,None,0.9,geojson/Illinois Counties.geojson,fillColor:blue;color:yellow,"Source: USGS, Tiger Line, IES - NCES, NC One Map, US Census Bureau",Kendall County,41.6828074
